{
  "api_version": "kdlc.dev/conformance-statement/v1alpha1",
  "specification": {"name": "K-DLC", "version": "0.2.0"},
  "implementation": {"name": "knowledge-dlc", "version": "0.0.0-private", "private": true},
  "release_status": "not-ready",
  "modules": [
    {"name": "Core", "status": "implemented", "requirement_ids": ["FEAT-001", "FEAT-003"], "evidence": [{"path":"tests/governance/core-contracts.test.mjs","sha256":"sha256:89e73c57c5b18b6f984c064888fbe5948347ce4a85d2fd741fa285147f084e08"},{"path":"tests/governance/core-runtime.test.mjs","sha256":"sha256:5399e6746afa90e0b17af83fa064b580e19f729f49fcf8f30f49abf405bf01c3"},{"path":"tests/governance/normalization.test.mjs","sha256":"sha256:8c784c4f8d27f447c373af8e17665e7e7d67330203ee56e60f0387d752dc7230"}]},
    {"name": "Lifecycle", "status": "implemented", "requirement_ids": ["FEAT-002"], "evidence": [{"path":"tests/governance/lifecycle-concurrency.test.mjs","sha256":"sha256:5581bbafe85cd5edf2ccb4dd7ddc08688c4636e62a95c6f3342109069d40c8eb"},{"path":"tests/governance/lifecycle.test.mjs","sha256":"sha256:85bc15f68e3ba564d1c3f4d9838e51703c1b0bf7266953fed062e367dba3e29d"}]},
    {"name": "Governed", "status": "implemented", "requirement_ids": ["FEAT-004", "FEAT-008", "FEAT-009"], "evidence": [{"path":"tests/governance/agent-workflows.test.mjs","sha256":"sha256:e3199b4e1102b9e9c08d775ef31781ef9be738494bfa879ecffc9ef60817d7b1"},{"path":"tests/governance/governed-controls.test.mjs","sha256":"sha256:6afd8731bb1883573e59ff08d74c2471b2608db687ed0e3a454cc7ea7f0c1f6c"},{"path":"tests/governance/revocation-erasure.test.mjs","sha256":"sha256:cc3b37fe2511228e6e763d4922f8e9920dd7553a4b1eaa7906d241fae7a635d8"}]},
    {"name": "Federated", "status": "implemented", "requirement_ids": ["FEAT-005"], "evidence": [{"path":"tests/governance/federation-retrieval.test.mjs","sha256":"sha256:93fc47f5b611034d888fcf1bdb2c1ea4b8001c1b307660adb841f2dfbc27fd0f"}]},
    {"name": "Served", "status": "implemented", "requirement_ids": ["FEAT-006"], "evidence": [{"path":"tests/governance/distribution.test.mjs","sha256":"sha256:4e84aefd0804df3da6ee94d93319d9455cba1b429548365c2707b9384bc025a7"}]}
  ],
  "format_profiles": ["markdown", "text", "csv", "pdf", "docx", "xlsx", "pptx", "drawio", "gif", "vsdx"],
  "tools": ["project_init", "project_get", "project_list_mounts", "kb_search", "kb_fetch", "kb_trace", "kb_conflicts", "kb_gaps", "source_excerpt", "job_status", "ingest_start", "proposal_create", "review_submit", "publish_request", "job_cancel"],
  "transports": ["stdio", "streamable-http"],
  "pending_requirements": [
    {"id": "REL-001", "issue": 10, "reason": "Statistical evaluation, final artifact/version agreement, external protections, and independent release verification remain pending.", "release_blocking": true}
  ],
  "evidence": [{"path":"distribution/release/evaluation-report.json","sha256":"sha256:b4ae0c7faa381e33adea95155c3c7e1d5eedf363bb5826735670aa299e8d10d0"},{"path":"docs/traceability.json","sha256":"sha256:467ff43c34e4ffbc3ab5c9d8bd88e13c0fd4da7cc8ef8ac9af8956c63c89700d"},{"path":"docs/release-readiness.md","sha256":"sha256:50fde18197710993f13ab039beff4f08173c035678472cd40396f10f3a22234c"}]
}
